[
    {
        "scene_id": "scene_001",
        "time_window": {
            "start": 0,
            "end": 4
        },
        "groups": [
            {
                "group_id": "FRONT_WASH",
                "parameters": {
                    "intensity": 0.0,
                    "color": "warm_white"
                },
                "transition": {
                    "type": "fade",
                    "duration": 3.0
                }
            },
            {
                "group_id": "BACK_LIGHT",
                "parameters": {
                    "intensity": 0.0,
                    "color": "warm_white"
                },
                "transition": {
                    "type": "fade",
                    "duration": 3.0
                }
            },
            {
                "group_id": "SIDE_FILL",
                "parameters": {
                    "intensity": 0.0,
                    "color": "warm_white"
                },
                "transition": {
                    "type": "fade",
                    "duration": 3.0
                }
            }
        ],
        "metadata": {
            "emotion": "neutral",
            "technique": "FADE IN - blackout"
        }
    },
    {
        "scene_id": "scene_002",
        "time_window": {
            "start": 4,
            "end": 33
        },
        "groups": [
            {
                "group_id": "FRONT_WASH",
                "parameters": {
                    "intensity": 0.4,
                    "color": "warm_amber"
                },
                "transition": {
                    "type": "fade",
                    "duration": 3.0
                }
            },
            {
                "group_id": "BACK_LIGHT",
                "parameters": {
                    "intensity": 0.2,
                    "color": "warm_white"
                },
                "transition": {
                    "type": "fade",
                    "duration": 3.0
                }
            },
            {
                "group_id": "SIDE_FILL",
                "parameters": {
                    "intensity": 0.3,
                    "color": "warm_amber"
                },
                "transition": {
                    "type": "fade",
                    "duration": 3.0
                }
            }
        ],
        "metadata": {
            "emotion": "neutral",
            "technique": "Dim warm interior - living room night"
        }
    },
    {
        "scene_id": "scene_003",
        "time_window": {
            "start": 35,
            "end": 37
        },
        "groups": [
            {
                "group_id": "FRONT_WASH",
                "parameters": {
                    "intensity": 0.3,
                    "color": "warm_amber"
                },
                "transition": {
                    "type": "fade",
                    "duration": 0.5
                }
            },
            {
                "group_id": "BACK_LIGHT",
                "parameters": {
                    "intensity": 0.1,
                    "color": "warm_white"
                },
                "transition": {
                    "type": "fade",
                    "duration": 0.5
                }
            },
            {
                "group_id": "SIDE_FILL",
                "parameters": {
                    "intensity": 0.2,
                    "color": "warm_amber"
                },
                "transition": {
                    "type": "fade",
                    "duration": 0.5
                }
            }
        ],
        "metadata": {
            "emotion": "neutral",
            "technique": "CUT TO - brief transition"
        }
    },
    {
        "scene_id": "scene_004",
        "time_window": {
            "start": 39,
            "end": 52
        },
        "groups": [
            {
                "group_id": "FRONT_WASH",
                "parameters": {
                    "intensity": 0.3,
                    "color": "warm_amber"
                },
                "transition": {
                    "type": "fade",
                    "duration": 2.0
                }
            },
            {
                "group_id": "BACK_LIGHT",
                "parameters": {
                    "intensity": 0.4,
                    "color": "cool_blue"
                },
                "transition": {
                    "type": "fade",
                    "duration": 2.0
                }
            },
            {
                "group_id": "SIDE_FILL",
                "parameters": {
                    "intensity": 0.5,
                    "color": "cool_blue"
                },
                "transition": {
                    "type": "fade",
                    "duration": 2.0
                }
            }
        ],
        "metadata": {
            "emotion": "fear",
            "technique": "Kitchen whisper - cold creeping in"
        }
    },
    {
        "scene_id": "scene_005",
        "time_window": {
            "start": 54,
            "end": 80
        },
        "groups": [
            {
                "group_id": "FRONT_WASH",
                "parameters": {
                    "intensity": 0.5,
                    "color": "warm_white"
                },
                "transition": {
                    "type": "fade",
                    "duration": 2.0
                }
            },
            {
                "group_id": "BACK_LIGHT",
                "parameters": {
                    "intensity": 0.3,
                    "color": "white"
                },
                "transition": {
                    "type": "fade",
                    "duration": 2.0
                }
            },
            {
                "group_id": "SIDE_FILL",
                "parameters": {
                    "intensity": 0.6,
                    "color": "cool_blue"
                },
                "transition": {
                    "type": "fade",
                    "duration": 3.0
                }
            }
        ],
        "metadata": {
            "emotion": "surprise",
            "technique": "Hallway - Lily disappears"
        }
    },
    {
        "scene_id": "scene_006",
        "time_window": {
            "start": 82,
            "end": 108
        },
        "groups": [
            {
                "group_id": "FRONT_WASH",
                "parameters": {
                    "intensity": 0.6,
                    "color": "warm_white"
                },
                "transition": {
                    "type": "fade",
                    "duration": 1.5
                }
            },
            {
                "group_id": "BACK_LIGHT",
                "parameters": {
                    "intensity": 0.7,
                    "color": "white"
                },
                "transition": {
                    "type": "fade",
                    "duration": 2.0
                }
            },
            {
                "group_id": "SIDE_FILL",
                "parameters": {
                    "intensity": 0.8,
                    "color": "white"
                },
                "transition": {
                    "type": "fade",
                    "duration": 2.0
                }
            }
        ],
        "metadata": {
            "emotion": "fear",
            "technique": "Living room panic - red danger wash"
        }
    },
    {
        "scene_id": "scene_007",
        "time_window": {
            "start": 110,
            "end": 112
        },
        "groups": [
            {
                "group_id": "FRONT_WASH",
                "parameters": {
                    "intensity": 0.1,
                    "color": "cool_blue"
                },
                "transition": {
                    "type": "fade",
                    "duration": 0.3
                }
            },
            {
                "group_id": "BACK_LIGHT",
                "parameters": {
                    "intensity": 0.1,
                    "color": "white"
                },
                "transition": {
                    "type": "fade",
                    "duration": 0.3
                }
            },
            {
                "group_id": "SIDE_FILL",
                "parameters": {
                    "intensity": 0.1,
                    "color": "cool_blue"
                },
                "transition": {
                    "type": "fade",
                    "duration": 0.3
                }
            }
        ],
        "metadata": {
            "emotion": "neutral",
            "technique": "CUT TO - near blackout"
        }
    },
    {
        "scene_id": "scene_008",
        "time_window": {
            "start": 114,
            "end": 144
        },
        "groups": [
            {
                "group_id": "FRONT_WASH",
                "parameters": {
                    "intensity": 0.2,
                    "color": "cool_blue"
                },
                "transition": {
                    "type": "fade",
                    "duration": 3.0
                }
            },
            {
                "group_id": "BACK_LIGHT",
                "parameters": {
                    "intensity": 0.5,
                    "color": "white"
                },
                "transition": {
                    "type": "fade",
                    "duration": 3.0
                }
            },
            {
                "group_id": "SIDE_FILL",
                "parameters": {
                    "intensity": 0.7,
                    "color": "cool_blue"
                },
                "transition": {
                    "type": "fade",
                    "duration": 3.0
                }
            }
        ],
        "metadata": {
            "emotion": "fear",
            "technique": "Basement descent - deep cold blue"
        }
    },
    {